### ISSUE TITLE
Relay sends unicast to Tailscale clients but Roon Remote never discovers server

### ISSUE THREAD

**Issue by joergweber** [simonefil/RoonBroadcastRelay#4]
I'm trying to use RoonBroadcastRelay with Tailscale to enable Roon Remote discovery from outside my home network. The relay is running on a dedicated Raspberry Pi on the same LAN as my Roon Server, with Tailscale providing the VPN tunnel to remote clients. The Pi is configured as the Tailscale subnet router for the LAN (though I tried with main router and roon server as subnet routers without success).

The relay works on the LAN side: it picks up Roon Server broadcasts and sends unicast packets to all configured Tailscale client IPs. However, Roon Remote on the clients never discovers the server. tcpdump on the Pi's tailscale0 interface reveals that the raw socket IP spoofing is being rewritten by the kernel before packets enter the Tailscale tunnel. The source IP arrives at clients as the Pi's Tailscale address rather than the Roon Server's LAN IP.

I may be missing something in my setup. Any guidance would be appreciated.

## Environment

- **Relay host**: Raspberry Pi 4, DietPi (Debian Bookworm), ARM64
- **Relay binary**: RoonBroadcastRelay-linux-arm64 (latest release)
- **Roon Server**: Intel NUC, DietPi, 192.168.1.6
- **Relay Pi**: 192.168.1.99 (LAN), 100.x.x.124 (Tailscale)
- **VPN**: Tailscale 1.94.2 on all devices
- **Clients tested**:
  - Windows 11 laptop (100.x.x.52) on external WiFi
  - Android phone (100.x.x.26) on cellular

## Network topology

```
Roon Server (192.168.1.6)
    |
    | LAN 192.168.1.0/24
    |
Relay Pi (192.168.1.99 / 100.x.x.124)
    |
    | Tailscale (WireGuard)
    |
Remote clients (100.x.x.x)
```

The Pi is the sole Tailscale subnet router for 192.168.1.0/24. All other devices had their subnet routes unapproved.

### appsettings.json

```json
{
  "SiteName": "PiRelay",
  "TunnelPort": 9004,
  "RemoteRelayIp": "",
  "LocalInterfaces": [
    {
      "LocalIp": "192.168.1.99",
      "BroadcastAddress": "192.168.1.255",
      "SubnetMask": "255.255.255.0"
    }
  ],
  "UnicastTargets": [
    "100.x.x.30",
    "100.x.x.26",
    "100.x.x.52"
  ],
  "Protocols": {
    "Raat": true,
    "AirPlay": false,
    "Ssdp": false,
    "Squeezebox": false
  }
}
```

### Tailscale on Pi

```bash
sudo tailscale up --advertise-routes=192.168.1.0/24 --accept-routes=false
```

Subnet route approved in admin console. IP forwarding enabled (`net.ipv4.ip_forward=1`).

## What works

- Relay starts correctly, binds to 0.0.0.0:9003, creates raw socket for IP spoofing
- Relay receives Roon Server broadcasts from 192.168.1.6 on the LAN
- Relay sends unicast to all three Tailscale client IPs
- Packets leave the Pi's tailscale0 interface (confirmed with tcpdump)
- All clients can ping 192.168.1.6 through the Pi's subnet route
- Roon Remote on clients is listening on UDP 9003 (confirmed with netstat)
- Windows firewall rule allows inbound UDP 9003

## What does not work

Roon Remote on clients never discovers the server. No client traffic appears in the relay logs (no `<- 100.x.x.x` entries). Discovery is completely one-directional.

## Key finding: raw socket IP spoofing is lost

tcpdump on the Pi's tailscale0 interface shows:

```
11:48:23.501870 IP 100.x.x.124.9003 > 100.x.x.30.9003: UDP, length 104
11:48:23.501968 IP 100.x.x.124.9003 > 100.x.x.26.9003: UDP, length 104
11:48:23.502046 IP 100.x.x.124.9003 > 100.x.x.52.9003: UDP, length 104
```

The source IP is **100.x.x.124** (the Pi's Tailscale IP), not 192.168.1.6 as the relay intended to spoof. The kernel rewrites the source IP when routing through the tailscale0 interface.

## What I tried

1. **Pi as sole Tailscale subnet router** for 192.168.1.0/24 to ensure clients accept packets with 192.168.1.x source IPs from the Pi's WireGuard tunnel. Did not help because the spoofing is lost before the packet even enters the tunnel.

2. **Multiple subnet router combinations** with the Pi, a router, and the NUC all advertising 192.168.1.0/24. Only one active at a time, various combinations tested.

## Questions/Comments

1.  The raw socket IP spoofing appears to be stripped by the kernel when routing through Tailscale's userspace tunnel.

2. The examples all show OPNsense with NAT port forward rules redirecting 255.255.255.255:9003 to the relay. Tailscale has no equivalent mechanism for client-side broadcast redirection. Is this NAT rule essential for the client-to-relay direction?

3. The WireGuard client configs in the examples include `AllowedIPs = ..., 255.255.255.255/32, 224.0.0.0/4`. Tailscale manages AllowedIPs automatically and silently ignores broadcast/multicast ranges. Is there a workaround?

## Relay logs (working correctly on LAN side)

```
[PiRelay] Starting Roon Relay
[PiRelay] Raat socket bound to 0.0.0.0:9003
[PiRelay] Raw socket created for IP spoofing
[PiRelay] Protocol Raat: port 9003, multicast 239.255.90.90, TTL=64
[PiRelay] LAN interface: 192.168.1.99 (broadcast: 192.168.1.255, mask: 255.255.255.0)
[PiRelay] Unicast target: 100.x.x.30
[PiRelay] Unicast target: 100.x.x.26
[PiRelay] Unicast target: 100.x.x.52
[PiRelay] Relay running. Press Ctrl+C to stop.
[PiRelay] Raat <- 192.168.1.6:38602 (104 bytes)
[PiRelay] Raat UNICAST -> 100.x.x.30:9003
[PiRelay] Raat UNICAST -> 100.x.x.26:9003
[PiRelay] Raat UNICAST -> 100.x.x.52:9003
```

**Comment by simonefil** [comment]
Thanks for the detailed report. Your diagnostics are thorough, but the root cause is different from what you suspect. Unfortunately, Tailscale is architecturally incompatible with this relay. Let me explain why.

The source IP issue is not what you think

You wrote that "raw socket IP spoofing is being rewritten by the kernel", but the unicast target path does not use raw sockets at all. When the relay forwards packets to unicast targets, it uses a regular UDP socket (lanSocket.SendTo()), not the raw socket with IP spoofing.
This is by design — the raw socket is only used for broadcasting/multicasting on local LAN interfaces where the spoofed source IP is needed for device discovery.

So the 100.x.x.124 source you see in tcpdump is the expected behavior for normal UDP sends. The OS picks the Pi's Tailscale IP as the source because that's the correct outbound interface for routing to 100.x.x.x destinations.

Why Tailscale is fundamentally incompatible

The relay was designed around kernel-level WireGuard, which differs from Tailscale in critical ways:

1. Raw socket IP spoofing
Even if I changed the unicast target path to use raw sockets, it still wouldn't work. Tailscale runs WireGuard in userspace via a tun device. When a raw packet with a spoofed source IP hits the tun interface, Tailscale's daemon re-encapsulates it and either rewrites the
source IP to the device's Tailscale address or drops it entirely. With kernel WireGuard, raw packets pass through the tunnel with their headers intact because encryption happens at the kernel level before any rewriting.

2. No broadcast/multicast support
The WireGuard configs in the examples include AllowedIPs = ..., 255.255.255.255/32, 224.0.0.0/4 specifically so that broadcast and multicast packets can traverse the tunnel. As you noted, Tailscale manages AllowedIPs automatically and silently ignores these ranges. There is
no workaround for this within Tailscale.

3. No client-side NAT rules (client→relay direction is completely broken)
This is the part your report doesn't cover, but it's equally critical. Your relay logs show zero inbound traffic from clients (no <- 100.x.x.x entries). That's because Roon Remote discovers servers by sending broadcast packets to 255.255.255.255:9003 (and multicast to
239.255.90.90:9003). These packets never reach the relay.

In the WireGuard examples, OPNsense NAT port-forward rules on the client side intercept the broadcast to 255.255.255.255:9003 and redirect it as unicast to the relay's IP. This is what makes bidirectional discovery work. Tailscale has no equivalent mechanism — you cannot
redirect client-side broadcasts to the relay.

So both directions are broken:
- Server → Client: packets arrive with the wrong source IP (Pi's Tailscale IP instead of Roon Server's LAN IP)
- Client → Server: broadcast discovery packets never leave the client's local network

To answer your questions directly

1. The raw socket IP spoofing appears to be stripped by the kernel when routing through Tailscale's userspace tunnel.

Correct conclusion, wrong premise. The unicast path doesn't use raw sockets, but even if it did, Tailscale's userspace architecture would rewrite the source IP.

2. Is the NAT rule essential for the client-to-relay direction?

Yes. Without it, Roon Remote's broadcast discovery packets have no way to reach the relay. The NAT rule is what converts the client's local broadcast into a routable unicast to the relay.

3. Tailscale manages AllowedIPs automatically and silently ignores broadcast/multicast ranges. Is there a workaround?

There is no workaround within Tailscale. This is a fundamental limitation of its architecture.
